"AU","AF","TI","SO","DE","ID","AB","C1","CR","NR","TC","J9","PY","VL","BP","SC","UT","IU","DP"
"張玨菁","Chueh- ching Chang","職前教師資訊科技融入教學素養課程實施成效之研究--運用數位化學習歷程檔案","國立臺南大學","反省思考; 合作學習; 數位化學習歷程檔案; 資訊科技融入教學; 資訊科技融入教學素養",,"數位化學習歷程檔案，即是將紙本的學習歷程檔案，以數位化的形式，如照片、影像、聲音等多元形式，加以展現、儲存學習作品，並透過網路平台，可不受時空、作品形式限制，讓同儕間的作品彼此分享、交流，藉由作品間的觀摩，提供自我反省之機會。應用數位化學習歷程檔案的教學方式於「資訊科技融入教學的理論與實務」課程，不但能營造學生隨時使用資訊科技的學習環境，亦希望透過數位化學習歷程檔案的教學方式，培養學生的反省思考與合作學習能力。
本研究旨在探討數位化學習歷程檔案對國民小學職前教師之資訊科技融入教學素養、反省思考能力與合作學習能力的成效，其次，希望瞭解職前教師對此課程教學安排與教學策略之建議。
本研究以12名台南大學教育系三年級之職前教師為研究對象，透過「資訊科技融入教學的理論與實務」實驗課程，進行十二週的學習活動，並利用職前教師於課程前後二次自評比較的方法，及研究者深入訪談、觀察與文件分析等方式蒐集相關資料，再針對這些資料進行分析與探究。
本研究的主要發現如下。
1.在資訊科技融入教學素養方面，經由三次自評結果比較，職前教師的整體資訊科技融入教學素養有顯著的提升，就具體成果而言，職前教師在(1)電腦軟硬體的操作、(2)相關理論的認知、(3)教學設計能力、(4)應用資訊科技於教學能力等四方面的能力皆有所提升。另外，職前教師對未來應用資訊科技於教學的看法，大多數的職前教師未來願意繼續以資訊科技融入教學的方式進行教學，但必須在學校硬體設備充足、學習領域內容許可、學生特質適切的情況下，才能順利進行。
2.在反省思考能力方面，主要分為描述性、比較性、批判性三個面向，而職前教師經由二次自評結果的比較，雖然只有在比較性的反省思考能力達到顯著提升，但就具體成果而言，職前教師在描述性的表現上，多能從學習過程中反省自己不足之處，在比較性的表現上，亦能站在學生立場，反省教學過程的缺失，但在批判性的反省思考能力上，則較少發現職前教師的具體表現。
3.在合作學習能力方面，職前教師的小組分工、工作效率、討論熱絡三方面，經由二次自評，其平均值都有成長，唯有紀錄準確方面，成長較小幅，是合作學習過程中，需要再加強的地方，而整個學習過程，職前教師也都能從剛開始的只分工、不合作的模式，改善至彼此分工合作的學習狀態。
4.職前教師進行「資訊科技融入教學的理論與實務」的學習後，對此課程內容安排與教學策略提出了五點建議：(1)在理論教學階段，增加學生報告分享的比例；(2)教學現場試教前，授課教師能與試教國小進行事先的正式溝通；(3)增加教學觀摩的課程；(4)於數位化學習歷程檔案系統方面，增加強制回饋的規定；(5)數位化學習歷程檔案系統可再增加互動性的設計。
最後，研究者根據研究結果，分別對教學實務及後續研究提出多項具體建議，以供未來各大專院校實施資訊科技融入教學相關課程及後續研究之參考。
","Taiwan","于富雲, 2001, 從理論基礎探究合作學習的教學效益, , ; 王全世, 2000, 資訊科技融入教學之意義與內涵資訊與教育, , ; 王全世, 2000, 對資訊科技融入各科教學之資訊情境的評估標準資訊與教育, , ; 王全世, 2001, 從教育改革來看資訊教育所扮演的角色資訊與教育, , ; 王詠, 2002, 教學創新多元評量─檔案評量評析, , ; 王為國, 2002, 多元智能取向之教學評量, , ; 尹玫君, 2003, 自教育科技在教育上的應用探討資訊融入教學, , ; 尹玫君, 2004, 知識經濟時代職前教師自主學習文化之建構─子計劃十一：網路資源與教育媒體融入的教學能力的培育與評鑑, , ; 何文慶, 2001, 由角色認知談國中教師在九年一貫課程改革的自我調適, , ; 吳正己, 2001, 從英特爾e教師計畫談資訊融入教學, , ; 吳芝儀, 1995, 質的評鑑與研究, , ; 吳青蓉, 1999, 跨世紀的教學革命--資訊科技融入學科教學, , ; 吳勇龍, 2003, 「合作學習」教學模式的探討, , ; 吳清山, 1997, 教育名詞：卷宗評量, , ; 吳毓瑩, 1998, 我看、我畫、我說、我演、我想、我是誰呀？卷宗評量概念、理論、與應用, , ; 沈中偉, 2001, 國小資訊教育理念與實踐：臨床教學之探究與省思, , ; 李新民, 2000, 電子卷宗在教育上的應用, , ; 李隆盛, 1998, Puzio的科技學習歷程紀錄評介, , ; 李隆盛, 2004, 學生學習檔案的5W1H, , ; 李昆翰, 2002, 正視國民資訊教育素養, , ; 李建鋒, 2005, 網路合作學習理論研究與系統實作, , ; 何榮桂, 1997, 我國中小學資訊教育的推展策略、問題與展望, , ; 何榮桂, 1999, 教育部「資訊教育基礎建設計畫」與北、高兩市「資訊教育白皮書」簡介, , ; 何榮桂, 2001, 他山之石可以攻錯─亞太地區資訊教育的發展與前瞻, , ; 何榮桂, 2002, 台灣資訊教育的現況與發展—兼論資訊科技融入教學, , ; 何榮桂, 1999, 各國資訊教育課程實施概況及其對九年一貫資訊課程的啟示, , ; 何縕琪, 1997, 卷宗評量在教學上之應用, , ; 杜正勝, 2004, 我國教育政策之現況與未來發展, , ; 邱幼樁, , 合作學習─讓高中生動起來, , ; 林奇賢, 2001, 知識經濟時代職前教師自主學習文化之建構─分項計畫一：職前教師學習歷程數位化檔案的系統建置與評量設計, , ; 林佩璇, 1992, 台灣省高級職業學校合作學習教學法實驗研究, , ; 林秋先, 2004, 資訊科技融入教學面臨的困境與契機, , ; 林美純, 2003, 職前教師資訊科技融入教學之成長模式, , ; 林清山, 1992, 心理與教育統計學, , ; 林煌凱, 2002, 國中教師教學創新接受度與資訊科技融入教學關注階層之相關研究, , ; 林傑斌, 2001, SPSS10.0 與統計模式建構, , ; 法務部, 2004, 全國法規資料庫─師資培育法, , ; 岳修平, 2000, 電子化學習歷程檔案實施之態度研究, , ; 徐新逸, 2002, 資訊融入教學的現代意義與具體作為, , ; 教育部, 1998, 國民中小學教師資訊基本素養指標, , ; 教育部, 2003, 九十二年度施政績效報告, , ; 張仁獻, 2002, 多元評量在生活科技課程教學之應用與實施策略, , ; 張巧琳, 2004, 促進教師專業成長以因應九年一貫課程改革, , ; 張美玉, 1996, 反省思考的教學模式在教育實習課程的應用, , ; 張美玉, 2001, 從多元智能的觀點談歷程檔案評量在教育上的應用, , ; 張美玉, 2000, 國小實習教師歷程檔案評量工具發展之研究, , ; 張秀雄, 2005, 合作學習法, , ; 張秀雄, 2005, 合作學習法, , ; 張郁雯, 2004, 運用資訊能力之檔案評量系統之發展研究台灣：科技化測驗與能力指標評量, , ; 張清源, 2003, 小組互評式電子卷宗教學在國小自然科學習上之研究, , ; 張基成, 2000, 一個架構於全球資訊網上的電子化學習歷程檔案, , ; 張基成, 2001, 網路化學習歷程於師資培育課程之實施經驗及探討, , ; 張國恩, 1999, 資訊融入各科教學之內涵與實施, , ; 張國恩, 2002, 從學習科技的發展看資訊融入教學的內涵, , ; 陳玉美, 2005, 以「合作學習」實踐語言溝通式教學, , ; 陳向明, 2002, 社會科學質的研究, , ; 陳永發, 2001, 合作取向的教師專業成長, , ; 陳美如, 2001, 教師如何從事課程評鑑：從賦權增能評鑑理念談起, , ; 陳泰安, 2002, 九年一貫課程教師資訊素養能力之探究, , ; 陳啟明, 1999, 另類的教學評量─「卷宗評量」, , ; 陳皓薇, 2003, 資訊科技融入教學, , ; 陳皓薇, 2003, 資訊科技融入教學, , ; 陳惠萍, 2004, 知識經濟時代職前教師自主學習文化之建構─子計劃十二：知識管理與班及經營能力的培育與評鑑, , ; 曾榮華, 2001, 反省思考教學的策略, , ; 曾錦達, 1997, 國民小學資訊教育之評析--對中華民國教育報告書的回應, , ; 張基成, 1997, 網路化學習歷程檔案系統, , ; 黃明月, 2001, 高等教育課程改革與教學科技運用, , ; 黃政傑, 1996, 合作學習, , ; 黃耿鐘, 2002, 網路學習檔案評量系統及學習檔案成效指標之研究, , ; 黃淑蘭, 2003, 國中小教師資訊應用基本素養之指標建構及初探模式驗證研究, , ; 單小琳, 2000, 教師成長檔案與專業發展, , ; 彭富源, 2001, 將資訊科技融入各科教學的困境與因應, , ; 溫其純, 2000, 師資培育者建構教學檔案可行性之研究－一個師範學院現場的反思, , ; 溫嘉榮, 2003, 教師如何將資訊融入學科成為教學工具, , ; 溫嘉榮, 2004, 教師資訊能力之檢測與培訓策略之探討, , ; 鄒慧英, 2000, 多元化的檔案評量, , ; 鄒慧英, 2004, 讀寫檔案的信度與評分者一致性科技化測驗與能力指標評量, , ; 鄒慧英, 2005, 知識經濟時代職前教師自主學習文化之建構─總計畫：數位化歷程檔案與反省式教學模式對師資培育效益之探討, , ; 趙志成, 2005, 見微集：學生互助互學、互相尊重─合作學習的要義, , ; 蔡俊男, 2000, 高雄市國小教師運用資訊設施教學意願之研究, , ; 蔡淑燕, 2003, 國小教師資訊科技融入教學知能之研究, , ; 歐滄和, 1999, 談學習歷程檔案法, , ; 劉遠楨, 2004, 淺談「資訊科技融入教學」, , ; 劉唯玉, 2000, 教學原理課程實施檔案評量之行動研究, , ; 賴俊明, 2004, 高二學生合作學習「氣體粒子性質」心智模式之探討, , ; 儲慧平, 2003, 提升學生學習動機的創新教學, , ; 謝佩君, 2004, 職前教師進行資訊科技融入專題導向學習態度之研究, , ; 盧雪梅, 2000, 多元教學評量的理念和實務, , ; 盧秀琴, 2002, 資訊教育融入國小課程的應用與省思, , ; 羅綸新, 2001, 教學檔案與教師專業成長, , ",,1,,2005,0,156,,"19","國立臺南大學",
"李桂英","Kuei-Ying Lee","以科技接受模式探討高一學生使用部落格建立學習歷程檔案之行為","高雄師範大學","部落格; 學習歷程檔案; 數位化學習歷程檔案; 科技接受模式; 整合性科技接受模式",,"本研究旨在引導高中學生使用部落格建立學習歷程檔案，藉由分析學生對數位化學習歷程檔案的使用行為，探討影響學生採用數位化學習歷程檔案的因素。
研究基礎援引整合性科技接受模式（UTAUT），並依部落格特性納入知覺愉悅構面建立理論架構。透過問卷調查法，輔以使用者訪談進行資料分析。本研究結果顯示：
1. 學生對學習歷程檔案的「使用意向」會正向影響「實際使用」。
2. 學生對學習歷程檔案的「績效預期」、「努力期望」、「社會影響」與「知覺愉悅」會正向影響「使用意向」，其中以「社會影響」最具影響力。
3. 學生對學習歷程檔案的「促成因素」並不影響「實際使用」。
4. 學生認同建立學習歷程檔案在學習活動的正面影響。
最後根據以上發現歸納結論並對實務提出具體的建議，以作為未來教師推行數位化學習歷程檔案時在課程設計與教學實施之參考。
","Taiwan","方興東, 2006, 追問博客傳播的意義：互聯網第二次革命, , ; 毛向輝, 2004, Blog將成為教育中的重要工具, , ; 王慧勤, 2002, 國語教學的情意評量, , ; 江雪齡, 1998, 介紹檔案評量法, , ; 余民寧, 1997, 教育測驗與評量—成就測驗與教學評量, , ; 吳明隆, 2008, SPSS統計應用實務, , ; 希瑞爾．菲飛特, 2006, 誰沒部落格！, , ; 李昆諭, 2005, 部落格網站使用行為之研究, , ; 李隆盛, 2004, 學生學習檔案的5W1H, , ; 周立軒, 2005, 網誌的使用者與使用行為之研究, , ; 岳修平, 2000, 電子化學習歷程檔案實施之態度研究, , ; 林克寰, 2004, 你不能不知道的部落格—Blog 是甚麼碗糕啊？, , ; 林奇賢, 2007, 數位學習歷程檔案系統在網路學習環境中的角色與意義, , ; 林凱胤, 2006, 以Blog作為互動式學習歷程檔案平台之應用, , ; 林淑美, 2005, Blog 在課後輔導之應用, , ; 邱皓政, 2003, 量化研究與統計分析, , ; 姚奉緒, 2004, 學習檔案的製作與推展, , ; 胡仲軒, 2004, RSS（Real Simple Syndication）—網頁資料交換技術介紹, , ; 張美玉, 1996, 歷程檔案評量再建構教學之應用：一個科學的實徵研究, , ; 張美玉, 2001, 從多元智能的觀點談歷程檔案評量在教育上的應用, , ; 張美玉, 2003, 歷程檔案評量在概念學習的應用, , ; 張基成, 2000, 網路化學習歷程檔案系統之建構與評鑑─一個電子化的真實性學習評量工具, , ; 張基成, 2001, 網路化學習歷程於師資培育課程之實施經驗及探討, , ; 張添洲, 2004, X檔案—教學檔案．學習檔案, , ; 張琬翔, 2008, 網路化教師評鑑檔案系統之研究—以花蓮教育大學為例, , ; 張鴻昌, 2004, 員工對企業內部網路接受度之研究—以中鋼公司為例, , ; 曹學仁, 2001, 從多元智慧的觀點談學生學習檔案之建構及其教育意涵, , ; 莊雅如, 2004, 以Weblog 為基礎的合作學習之研究, , ; 陳向東, 2002, 博客文化與現代教育技術, , ; 陳順孝, 2006, 部落格在教育上的運用, , ; 陳聖模, 1998, 「檔案」在師資培育上的應用, , ; 游光昭, 2003, 網路化學習歷程檔案與科技的學習, , ; 童宜慧, 1998, 網路化學習歷程檔案系統之建構與實施, , ; 游雅婷, 2006, Blog網誌對國小高年級學童寫作之影響, , ; 游雅慧, 2005, 部落格使用者接受度之研究—以彰化縣中小學教師為例, , ; 鄒景平, 2003, 非正式內容愈見重要, , ; 廖麗鄉, 2007, 以部落格建構高職學生電子化學習檔案之行動研究—多元智能觀點, , ; 熊召弟, 2003, 卷宗評量的設計及應用─以自然科為例, , ; 蔡孟倫, 2007, 國民小學閱讀部落格建構及其滿意度之行動研究, , ; 蔡清華, 1996, 「教學檔案」在國小實習教師專業成長與評鑑上的應用, , ; 盧雪梅, 2001, 學習檔案評量的理念與實務, , ; 戴良育, 2005, Blog在學習歷程檔案上的應用—以高中職為例, , ; 藝立協, 2003, Blog 部落格線上出版．網路日誌實作, , ",,1,,2009,0,112,,"2","高雄師範大學",
"林朝敏","Chao-Min Lin","網路學習歷程檔案系統中提供自動化工作日誌支援同儕互評之研究","國立臺南大學","同儕互評; 網路學習歷程檔案; 自動化工作日誌",,"學習歷程檔案是有計劃的收集學生作品樣本，可以明確的呈現學生在一段時間內學習成長進步的過程。同儕互評可以提昇學生思考反省及學習動機。但普遍看法認為同儕互評比較合適在高等教育學生中實施，對國中小學生的評分能力有所質疑。因此，本研究設計一套符合國小學童使用的網路學習歷程檔案系統，完整收集參與者網路學習歷程，經過統計轉化製成圖表，配合學生撰寫的工作日誌，成為詳盡記錄學生學習狀況的自動化工作日誌；提供給國小學童進行同儕互評時做參考，幫助評分者更加了解作者的學習狀況，使同儕互評評分更準確。並採準實驗研究法，以台南縣某國小136名六年級學生為研究對象，將學生以原班級為單位隨機分為三組，在同儕互評時提供不同的參考資料，比較學生評分與教師評分的一致性。研究結果發現：1.本研究所提供之網路學習歷程檔案系統弁鉦臟X國小學童使用需求。2.在應用自動化工作日誌提供同儕互評參考時，同學評分效度比未提供參考的組別高。3.學生對實施同儕互評具有很高的接受度，但對提供的自動化工作日誌是否會影響評分標準的看法分歧。
","Taiwan","江蕙如, 2002, 網路化同儕回饋與學生學習成就之初探性研究, , ; 吳信賢, 2000, 非同步網路教學系統之發展及學習歷程檔案, , ; 吳清山, 1997, 教育名詞：卷宗評量, , ; 呂靜芳, 2000, 由網站行為歷程以貝式學習建立學習者模式之引導系統, , ; 李坤崇, 1999, 多元化教學評量, , ; 林孟鴻, 2001, 應用歷程檔案建立網路學習輔助機制, , ; 林珊如, 2001, 網路化學習歷程與同儕互評系統之建構經驗, , ; 林珊如, 1999, 網路同儕互評系統的學生群組分析, , ; 林英文, 2002, 線上同儕評量對國中生簡報製作技能學習成效之研究, , ; 卓宜青, 2001, 網路化學習歷程檔案系統及同儕評量, , ; 邱繼弘, 1998, 架構在 Web 上的作業相互評量系統, , ; 張基成, 2001, 網路化學習檔案之系統化建構經驗及相關問題探討, , ; 張基成, 2001, 網路化學習歷程於師資培育課程之實施經驗及探討, , ; 張基成, 2000, 一個架構於全球資訊網上的電子化學習歷程檔案, , ; 張清濱, 1996, 個人檔案紀錄有何妙用?多元化的教學評量, , ; 梁宗賀, 2000, 網路卷宗系統之發展與應用, , ; 陳年興, 2000, 建構式網路教學系統設計原則與評量結果, , ; 陳年興, 2001, 網路學習之學習行為與學習成效分析, , ; 陳年興, 2001, 網路學習之學習歷程分析系統, , ; 陳信汛, 2002, 應用群集技術支援國小學童網路同儕互評之研究, , ; 陳得利, 2001, 網路化歷程檔案系統之設計與實作, , ; 張基成, 1999, 網路化學習歷程檔案系統, , ; 黃耿鐘, 2002, 網路學習檔案評量系統及學習檔案成效指標之研究, , ; 黃履發, 1996, 學習歷程檢視器：Web學習環境中學習管理工具, , ; 楊國鑫, 2001, 推廣網路同儕互評系統於高級工業職業學校教學課程之研究, , ; 鄒慧英, 1999, 檔案於國語科教學評量之應用新世紀中小學課程改革與創新, , ; 劉旨峰, 1999, 網路同儕互評系統的學生群組分析, , ; 劉旨峰, 2002, 網路同儕互評的探討、實施、評估與增進實施品質的建議, , ; 劉旨峰, 2002, 網路同儕評量之研究, , ; 劉旨峰, 2001,  基於網路同儕互評之學習歷程之信效度研究, , ; 劉旨峰, 2003, 探討學習回饋分析與網路學習系統滿意度調查之實證研究, , ; 劉勝鈺, 2002, 使用資訊科技學習數學：以網路同儕互評為例, , ; 劉惠如, 1999, 整合式網路教學之教學設計與評量, , ; 歐滄和, 1999, 談學習歷程檔案法的點點滴滴, , ; 蔡旻芳, 2001, 網路學習之學習歷程分析系統, , ; 鄭麗玉, 1999, 教學評量的改革, , ",,7,,2004,0,75,,"20","國立臺南大學",
